{
  "components": "components",
  "out": "src/generated",
  "router": {
    "routes": { "pages": "pages" }
  },
  "stores": "stores",
  "unions": {
    "Tone": "crate::domain::Tone"
  },
  "i18n": {
    "messages": "locales",
    "locale": "en",
    "fallbackLocale": "en"
  },
  "twins": {
    "StarRating": {
      "rust": "crate::twins::star_rating",
      "props": {
        "value": "int",
        "max": "int?"
      },
      "slots": ["default"]
    }
  }
}
